{
  "format_version": 1,
  "package": "./goplint",
  "toolchain": "go1.26.5",
  "generated_at": "2026-07-19T19:54:08.618022987Z",
  "default_weight_nanoseconds": 147970000000,
  "reviewed_internal_shard_ids": [],
  "environment": [
    "GOPLINT_PROTOCOL_ORACLE_PROFILE=scheduled"
  ],
  "entries": [
    {
      "id": "FuzzFindingDeterminism",
      "kind": "fuzz",
      "duration_weight_nanoseconds": 1,
      "sample_count": 3,
      "nested_case_count": 8,
      "maximum_nested_case_nanoseconds": 0
    },
    {
      "id": "FuzzIFDSTabulation",
      "kind": "fuzz",
      "duration_weight_nanoseconds": 1100000000,
      "sample_count": 3,
      "nested_case_count": 21,
      "maximum_nested_case_nanoseconds": 170000000
    },
    {
      "id": "FuzzInterprocSupergraphConstruction",
      "kind": "fuzz",
      "duration_weight_nanoseconds": 1,
      "sample_count": 3,
      "nested_case_count": 12,
      "maximum_nested_case_nanoseconds": 0
    },
    {
      "id": "FuzzProtocolSummaryFactSerialization",
      "kind": "fuzz",
      "duration_weight_nanoseconds": 1,
      "sample_count": 3,
      "nested_case_count": 7,
      "maximum_nested_case_nanoseconds": 0
    },
    {
      "id": "FuzzSSAConstraintNormalizationEvidence",
      "kind": "fuzz",
      "duration_weight_nanoseconds": 1,
      "sample_count": 3,
      "nested_case_count": 8,
      "maximum_nested_case_nanoseconds": 0
    },
    {
      "id": "FuzzSemanticCatalogDecoding",
      "kind": "fuzz",
      "duration_weight_nanoseconds": 10000000,
      "sample_count": 3,
      "nested_case_count": 7,
      "maximum_nested_case_nanoseconds": 10000000
    },
    {
      "id": "FuzzSemanticCategoryEvidence",
      "kind": "fuzz",
      "duration_weight_nanoseconds": 80000000,
      "sample_count": 3,
      "nested_case_count": 6,
      "maximum_nested_case_nanoseconds": 20000000
    },
    {
      "id": "TestAdaptiveBlockVisitBudgetScalesByCFGSize",
      "kind": "test",
      "duration_weight_nanoseconds": 1,
      "sample_count": 3,
      "nested_case_count": 0,
      "maximum_nested_case_nanoseconds": 0
    },
    {
      "id": "TestAddCFGWitnessCallChainMeta",
      "kind": "test",
      "duration_weight_nanoseconds": 1,
      "sample_count": 3,
      "nested_case_count": 0,
      "maximum_nested_case_nanoseconds": 0
    },
    {
      "id": "TestAmbiguousAliasPreservingSummaryIsIrrelevant",
      "kind": "test",
      "duration_weight_nanoseconds": 14850000000,
      "sample_count": 3,
      "nested_case_count": 0,
      "maximum_nested_case_nanoseconds": 0
    },
    {
      "id": "TestAmbiguousLiteralRemainsInProcedureInventoryAsBlockingRoot",
      "kind": "test",
      "duration_weight_nanoseconds": 1,
      "sample_count": 3,
      "nested_case_count": 0,
      "maximum_nested_case_nanoseconds": 0
    },
    {
      "id": "TestAnalysisPackageCensusIncludesPackagesWithoutDiagnostics",
      "kind": "test",
      "duration_weight_nanoseconds": 1,
      "sample_count": 3,
      "nested_case_count": 0,
      "maximum_nested_case_nanoseconds": 0
    },
    {
      "id": "TestAnalyzer",
      "kind": "test",
      "duration_weight_nanoseconds": 980000000,
      "sample_count": 3,
      "nested_case_count": 0,
      "maximum_nested_case_nanoseconds": 0
    },
    {
      "id": "TestAnalyzerWithConfig",
      "kind": "test",
      "duration_weight_nanoseconds": 16110000000,
      "sample_count": 3,
      "nested_case_count": 0,
      "maximum_nested_case_nanoseconds": 0
    },
    {
      "id": "TestAnalyzerWithRealExceptionsToml",
      "kind": "test",
      "duration_weight_nanoseconds": 14030000000,
      "sample_count": 3,
      "nested_case_count": 0,
      "maximum_nested_case_nanoseconds": 0
    },
    {
      "id": "TestAuditExceptionReviewDatesDoesNotRequirePackages",
      "kind": "test",
      "duration_weight_nanoseconds": 1,
      "sample_count": 3,
      "nested_case_count": 0,
      "maximum_nested_case_nanoseconds": 0
    },
    {
      "id": "TestAuditExceptions",
      "kind": "test",
      "duration_weight_nanoseconds": 20680000000,
      "sample_count": 3,
      "nested_case_count": 0,
      "maximum_nested_case_nanoseconds": 0
    },
    {
      "id": "TestAuditExceptionsMultiPackage",
      "kind": "test",
      "duration_weight_nanoseconds": 21450000000,
      "sample_count": 3,
      "nested_case_count": 0,
      "maximum_nested_case_nanoseconds": 0
    },
    {
      "id": "TestAuditReviewDates",
      "kind": "test",
      "duration_weight_nanoseconds": 15360000000,
      "sample_count": 3,
      "nested_case_count": 0,
      "maximum_nested_case_nanoseconds": 0
    },
    {
      "id": "TestBaselineCategoryCompleteness",
      "kind": "test",
      "duration_weight_nanoseconds": 1,
      "sample_count": 3,
      "nested_case_count": 0,
      "maximum_nested_case_nanoseconds": 0
    },
    {
      "id": "TestBaselineCollectionRejectsProtocolInconclusiveFindings",
      "kind": "test",
      "duration_weight_nanoseconds": 1,
      "sample_count": 3,
      "nested_case_count": 4,
      "maximum_nested_case_nanoseconds": 0
    },
    {
      "id": "TestBaselineContainsFinding",
      "kind": "test",
      "duration_weight_nanoseconds": 1,
      "sample_count": 3,
      "nested_case_count": 15,
      "maximum_nested_case_nanoseconds": 0
    },
    {
      "id": "TestBaselineLoadAndWriteRejectDuplicateAndCollidedIDs",
      "kind": "test",
      "duration_weight_nanoseconds": 1,
      "sample_count": 3,
      "nested_case_count": 3,
      "maximum_nested_case_nanoseconds": 0
    },
    {
      "id": "TestBaselineNeverMatchesProtocolInconclusiveCategories",
      "kind": "test",
      "duration_weight_nanoseconds": 1,
      "sample_count": 3,
      "nested_case_count": 3,
      "maximum_nested_case_nanoseconds": 0
    },
    {
      "id": "TestBaselineRoundTrip",
      "kind": "test",
      "duration_weight_nanoseconds": 1,
      "sample_count": 3,
      "nested_case_count": 0,
      "maximum_nested_case_nanoseconds": 0
    },
    {
      "id": "TestBaselineSupplementaryCategories",
      "kind": "test",
      "duration_weight_nanoseconds": 20370000000,
      "sample_count": 3,
      "nested_case_count": 0,
      "maximum_nested_case_nanoseconds": 0
    },
    {
      "id": "TestBaselineSuppression",
      "kind": "test",
      "duration_weight_nanoseconds": 16719999999,
      "sample_count": 3,
      "nested_case_count": 0,
      "maximum_nested_case_nanoseconds": 0
    },
    {
      "id": "TestBoundaryRequestBlockTerminatesShapes",
      "kind": "test",
      "duration_weight_nanoseconds": 1,
      "sample_count": 3,
      "nested_case_count": 0,
      "maximum_nested_case_nanoseconds": 0
    },
    {
      "id": "TestBoundaryRequestDefaulting",
      "kind": "test",
      "duration_weight_nanoseconds": 1,
      "sample_count": 3,
      "nested_case_count": 0,
      "maximum_nested_case_nanoseconds": 0
    },
    {
      "id": "TestBoundaryRequestFuncReturnsErrorShapes",
      "kind": "test",
      "duration_weight_nanoseconds": 1,
      "sample_count": 3,
      "nested_case_count": 0,
      "maximum_nested_case_nanoseconds": 0
    },
    {
      "id": "TestBoundaryRequestInconclusiveIgnoresConfigException",
      "kind": "test",
      "duration_weight_nanoseconds": 22710000000,
      "sample_count": 3,
      "nested_case_count": 0,
      "maximum_nested_case_nanoseconds": 0
    },
    {
      "id": "TestBoundaryRequestLocalAliasStmt",
      "kind": "test",
      "duration_weight_nanoseconds": 1,
      "sample_count": 3,
      "nested_case_count": 0,
      "maximum_nested_case_nanoseconds": 0
    },
    {
      "id": "TestBoundaryRequestWithoutProtocolParamsSkipsSummaryWork",
      "kind": "test",
      "duration_weight_nanoseconds": 1,
      "sample_count": 3,
      "nested_case_count": 0,
      "maximum_nested_case_nanoseconds": 0
    },
    {
      "id": "TestBoundaryRequestZeroLiteralShapes",
      "kind": "test",
      "duration_weight_nanoseconds": 1,
      "sample_count": 3,
      "nested_case_count": 0,
      "maximum_nested_case_nanoseconds": 0
    },
    {
      "id": "TestBuildFuncCFGForPass",
      "kind": "test",
      "duration_weight_nanoseconds": 1,
      "sample_count": 3,
      "nested_case_count": 4,
      "maximum_nested_case_nanoseconds": 0
    },
    {
      "id": "TestBuildInterprocSupergraphClassifiesBuiltinCall",
      "kind": "test",
      "duration_weight_nanoseconds": 1,
      "sample_count": 3,
      "nested_case_count": 0,
      "maximum_nested_case_nanoseconds": 0
    },
    {
      "id": "TestBuildInterprocSupergraphFromCFGWithResolutionLinksResolvedCallee",
      "kind": "test",
      "duration_weight_nanoseconds": 1,
      "sample_count": 3,
      "nested_case_count": 0,
      "maximum_nested_case_nanoseconds": 0
    },
    {
      "id": "TestBuildInterprocSupergraphKeepsCallAndNonCallEffectsDistinct",
      "kind": "test",
      "duration_weight_nanoseconds": 1,
      "sample_count": 3,
      "nested_case_count": 0,
      "maximum_nested_case_nanoseconds": 0
    },
    {
      "id": "TestBuildInterprocSupergraphLinksIIFEProcedure",
      "kind": "test",
      "duration_weight_nanoseconds": 1,
      "sample_count": 3,
      "nested_case_count": 0,
      "maximum_nested_case_nanoseconds": 0
    },
    {
      "id": "TestBuildInterprocSupergraphLinksResolvedCalleeEntryAndReturn",
      "kind": "test",
      "duration_weight_nanoseconds": 1,
      "sample_count": 3,
      "nested_case_count": 0,
      "maximum_nested_case_nanoseconds": 0
    },
    {
      "id": "TestBuildInterprocSupergraphOrdersNestedCalls",
      "kind": "test",
      "duration_weight_nanoseconds": 1,
      "sample_count": 3,
      "nested_case_count": 0,
      "maximum_nested_case_nanoseconds": 0
    },
    {
      "id": "TestBuildInterprocSupergraphSummarizesValidateCall",
      "kind": "test",
      "duration_weight_nanoseconds": 1,
      "sample_count": 3,
      "nested_case_count": 0,